[{"issue": {"body": "<pre><yamldata>\r\nCosa: Prova\r\nDescrizione: Bla bla\r\nLink: https://www.example.org\r\n</yamldata></pre>", "created_at": "2022-03-02T07:23:43+00:00", "data": {"Cosa": "Prova", "Descrizione": "Bla bla", "Link": "https://www.example.org"}, "id": 1156645726, "image": null, "labels": "[\"Accettato\"]", "lat": null, "lon": null, "milestone": null, "provincia": null, "regione": null, "title": "Prova1", "updated_at": "2022-03-02T08:01:39+00:00", "url": "https://github.com/emergenzeHack/europehelp.info_segnalazioni/issues/1"}, "number": 1, "state": "open", "title": "Prova1"}, {"issue": {"body": "<pre><yamldata>\naddress:\n  address:\n    address:\n      city: Milano\n      country: Italia\n      country_code: it\n      county: Milano\n      postcode: '20142'\n      quarter: Tibaldi\n      road: Via Bordighera\n      state: Lombardia\n      suburb: Chiesa Rossa\n    boundingbox:\n    - '45.43799'\n    - '45.4388822'\n    - '9.1736072'\n    - '9.1736512'\n    class: highway\n    display_name: Via Bordighera, Tibaldi, Chiesa Rossa, Milano, Lombardia, 20142,\n      Italia\n    importance: 0.41000000000000003\n    lat: '45.4383509'\n    licence: Data © OpenStreetMap contributors, ODbL 1.0. https://osm.org/copyright\n    lon: '9.173625'\n    osm_id: 128185642\n    osm_type: way\n    place_id: 131641506\n    type: unclassified\n  mode: autocomplete\ndescription: \"Ciai - Centro italiano aiuti all’infanzia ha attivato un servizio di\\\n  \\ supporto psicologico online gratuito per:\\n➡️famiglie, adulti, ragazzi ucraini\\\n  \\ che vivono in Italia o sono appena arrivati\\n➡️persone che ospitano rifugiati\\n\\\n  ➡️associazioni\\n\\nIl servizio è attivo su tutto il territorio nazionale. Per richiederlo:\\n\\\n  Tel. 02 8484 4448 (orario di ufficio). \\nciaipe@ciai.it\"\niConfirmToHaveReadAndAcceptedInformativeToThreatPersonalData: true\nlabel: services\nofferFromWho: 'Ciai onlus '\nrecipients: 'Rifugiati ucraini (adulti e ragazzi) e chi li ospita, associazioni '\nsubmit: true\ntitle: Ciai attiva supporto psicologico online per rifugiati ucraini (adulti e ragazzi)\n  e chi li ospita\ntype: psychologicalSupport\nurl: https://ciai.it/emergenza-ucraina-attivato-sportello-per-supporto-psicologico/\n</yamldata></pre>", "created_at": "2022-03-06T15:57:13+00:00", "data": {"address": {"address": {"address": {"city": "Milano", "country": "Italia", "country_code": "it", "county": "Milano", "postcode": "20142", "quarter": "Tibaldi", "road": "Via Bordighera", "state": "Lombardia", "suburb": "Chiesa Rossa"}, "boundingbox": ["45.43799", "45.4388822", "9.1736072", "9.1736512"], "class": "highway", "display_name": "Via Bordighera, Tibaldi, Chiesa Rossa, Milano, Lombardia, 20142, Italia", "importance": 0.41000000000000003, "lat": "45.4383509", "licence": "Data © OpenStreetMap contributors, ODbL 1.0. https://osm.org/copyright", "lon": "9.173625", "osm_id": 128185642, "osm_type": "way", "place_id": 131641506, "type": "unclassified"}, "mode": "autocomplete"}, "description": "Ciai - Centro italiano aiuti all’infanzia ha attivato un servizio di supporto psicologico online gratuito per:\n➡️famiglie, adulti, ragazzi ucraini che vivono in Italia o sono appena arrivati\n➡️persone che ospitano rifugiati\n➡️associazioni\n\nIl servizio è attivo su tutto il territorio nazionale. Per richiederlo:\nTel. 02 8484 4448 (orario di ufficio). \nciaipe@ciai.it", "iConfirmToHaveReadAndAcceptedInformativeToThreatPersonalData": true, "label": "services", "offerFromWho": "Ciai onlus ", "recipients": "Rifugiati ucraini (adulti e ragazzi) e chi li ospita, associazioni ", "submit": true, "title": "Ciai attiva supporto psicologico online per rifugiati ucraini (adulti e ragazzi) e chi li ospita", "type": "psychologicalSupport", "url": "https://ciai.it/emergenza-ucraina-attivato-sportello-per-supporto-psicologico/"}, "id": 1160646174, "image": null, "labels": "[\"Accettato\", \"Missing position\", \"services\"]", "lat": null, "lon": null, "milestone": null, "provincia": null, "regione": null, "title": "Ciai attiva supporto psicologico online per rifugiati ucraini (adulti e ragazzi) e chi li ospita", "updated_at": "2022-03-06T22:18:32+00:00", "url": "https://github.com/emergenzeHack/europehelp.info_segnalazioni/issues/23"}, "number": 23, "state": "open", "title": "Ciai attiva supporto psicologico online per rifugiati ucraini (adulti e ragazzi) e chi li ospita"}, {"issue": {"body": "<pre><yamldata>\ntype: disabilityServices\nofferFromWho: . The Emilia-Romagna Regional Branch of the Italian Deaf Association  (ENS)\ntitle: LIS Service to support deaf refugees\nrecipients: Deaf\ndescription: 'has set up a network of regional community/communication services to\n  support Ukraine deaf refugees arriving in the Emilia Romagna region. These services\n  aim to facilitate communication with local public bodies and public services thanks\n  to deaf interpreters and mediators who know Ukrainian Sign Language.   Further info\n  at emiliaromagna@ens.it  They released this signed video here attached: [https://youtube.com/watch?v=604vD8haZh8&feature=share](https://youtube.com/watch?v=604vD8haZh8&feature=share&fbclid=IwAR1_Pd9g8BXcSeZXSCrEU_1FrCxlhXs01r6TgXeNOo6NVzNfrFOm_LqBkos)\n  EUD - The European Union of the Deaf  Christian Rathmann Debra Russell Arunas Brazas\n  NRW: Deaf Refugees World Federation of the Deaf Ry Lorraine Leeson Anna Komarova\n  Igor Chavrot'\nurl: https://www.facebook.com/groups/ukraineinfo.help/permalink/451623253373295/\naddress:\n  mode: autocomplete\n  address:\n    place_id: 284543523\n    licence: Data © OpenStreetMap contributors, ODbL 1.0. https://osm.org/copyright\n    osm_type: relation\n    osm_id: 43415\n    boundingbox:\n    - '44.6244638'\n    - '44.7744479'\n    - '10.4910178'\n    - '10.7733414'\n    lat: '44.6978389'\n    lon: '10.6304971'\n    display_name: Reggio nell'Emilia, Emilia-Romagna, Italia\n    class: boundary\n    type: administrative\n    importance: 0.6725411725065691\n    icon: https://nominatim.openstreetmap.org/ui/mapicons//poi_boundary_administrative.p.20.png\n    address:\n      city: Reggio nell'Emilia\n      county: Reggio nell'Emilia\n      state: Emilia-Romagna\n      country: Italia\n      country_code: it\niConfirmToHaveReadAndAcceptedInformativeToThreatPersonalData: true\nlabel: services\nsubmit: true\n</yamldata></pre>", "created_at": "2022-03-07T21:34:37+00:00", "data": {"address": {"address": {"address": {"city": "Reggio nell'Emilia", "country": "Italia", "country_code": "it", "county": "Reggio nell'Emilia", "state": "Emilia-Romagna"}, "boundingbox": ["44.6244638", "44.7744479", "10.4910178", "10.7733414"], "class": "boundary", "display_name": "Reggio nell'Emilia, Emilia-Romagna, Italia", "icon": "https://nominatim.openstreetmap.org/ui/mapicons//poi_boundary_administrative.p.20.png", "importance": 0.6725411725065691, "lat": "44.6978389", "licence": "Data © OpenStreetMap contributors, ODbL 1.0. https://osm.org/copyright", "lon": "10.6304971", "osm_id": 43415, "osm_type": "relation", "place_id": 284543523, "type": "administrative"}, "mode": "autocomplete"}, "description": "has set up a network of regional community/communication services to support Ukraine deaf refugees arriving in the Emilia Romagna region. These services aim to facilitate communication with local public bodies and public services thanks to deaf interpreters and mediators who know Ukrainian Sign Language.   Further info at emiliaromagna@ens.it  They released this signed video here attached: [https://youtube.com/watch?v=604vD8haZh8&feature=share](https://youtube.com/watch?v=604vD8haZh8&feature=share&fbclid=IwAR1_Pd9g8BXcSeZXSCrEU_1FrCxlhXs01r6TgXeNOo6NVzNfrFOm_LqBkos) EUD - The European Union of the Deaf  Christian Rathmann Debra Russell Arunas Brazas NRW: Deaf Refugees World Federation of the Deaf Ry Lorraine Leeson Anna Komarova Igor Chavrot", "iConfirmToHaveReadAndAcceptedInformativeToThreatPersonalData": true, "label": "services", "offerFromWho": ". The Emilia-Romagna Regional Branch of the Italian Deaf Association  (ENS)", "recipients": "Deaf", "submit": true, "title": "LIS Service to support deaf refugees", "type": "disabilityServices", "url": "https://www.facebook.com/groups/ukraineinfo.help/permalink/451623253373295/"}, "id": 1161949488, "image": null, "labels": "[\"Valid/Accettato\", \"Services/Solidal Initiatives\", \"Disability\"]", "lat": null, "lon": null, "milestone": null, "provincia": null, "regione": null, "title": "Ukranian sign language services to support deaf refugees", "updated_at": "2022-03-08T15:09:33+00:00", "url": "https://github.com/emergenzeHack/europehelp.info_segnalazioni/issues/40"}, "number": 40, "state": "open", "title": "Ukranian sign language services to support deaf refugees"}, {"issue": {"body": "<pre><yamldata>\r\ntitle: File condiviso con aggiornamenti dai confini ucraini (tempi di attesa, altre\r\n  info)\r\ndescription: 'Sul gruppo Telegram Italiani in Ucraina (https://t.me/italianiucraina/8874)\r\n  pubblicato un Googlesheet con aggiornamenti dai confini ucraini, con tempi di attesa\r\n  e chat di info.\r\n\r\n  (Qui link al post originale https://t.me/italianiucraina/8874)'\r\nlink: https://docs.google.com/spreadsheets/d/e/2PACX-1vTmKNAxZn2cPpBqPHnRx9Hc_GPzfi7U92h05hkNuES6pA8l7IcbfdRELMkTBWGcBFoRkUdwlnfX889X/pubhtml?gid=0&single=true&fbclid=IwAR1qTqmfhHYDYFB_N14kCXweiK3BWVGzSfIYlpnD1UhYU33c-Tm0LJQYSuw\r\nlocation:\r\n  mode: autocomplete\r\n  address:\r\n    mode: autocomplete\r\n    address: {}\r\nlabel: news\r\niConfirmToHaveReadAndAcceptedPrivacyInformativeToThreatPersonalData: true\r\nsubmit: true\r\n</yamldata></pre>", "created_at": "2022-03-08T15:41:44+00:00", "data": {"description": "Sul gruppo Telegram Italiani in Ucraina (https://t.me/italianiucraina/8874) pubblicato un Googlesheet con aggiornamenti dai confini ucraini, con tempi di attesa e chat di info.\n(Qui link al post originale https://t.me/italianiucraina/8874)", "iConfirmToHaveReadAndAcceptedPrivacyInformativeToThreatPersonalData": true, "label": "news", "link": "https://docs.google.com/spreadsheets/d/e/2PACX-1vTmKNAxZn2cPpBqPHnRx9Hc_GPzfi7U92h05hkNuES6pA8l7IcbfdRELMkTBWGcBFoRkUdwlnfX889X/pubhtml?gid=0&single=true&fbclid=IwAR1qTqmfhHYDYFB_N14kCXweiK3BWVGzSfIYlpnD1UhYU33c-Tm0LJQYSuw", "location": {"address": {"address": {}, "mode": "autocomplete"}, "mode": "autocomplete"}, "submit": true, "title": "File condiviso con aggiornamenti dai confini ucraini (tempi di attesa, altre info)"}, "id": 1162811173, "image": null, "labels": "[\"Valid/Accettato\", \"News\", \"Travel/Transport\"]", "lat": null, "lon": null, "milestone": null, "provincia": null, "regione": null, "title": "File condiviso con aggiornamenti dai confini ucraini (tempi di attesa, altre info)", "updated_at": "2022-03-08T16:03:28+00:00", "url": "https://github.com/emergenzeHack/europehelp.info_segnalazioni/issues/43"}, "number": 43, "state": "open", "title": "File condiviso con aggiornamenti dai confini ucraini (tempi di attesa, altre info)"}, {"issue": {"body": "<pre><yamldata>\r\nnameSurname: Ciccio Graziani\r\nphoneNumber: '12345'\r\nemail: ciccio@graziani.com\r\ntitle: prova\r\nrecipients: ''\r\ndescription: ''\r\nurl: ''\r\nlocation:\r\n  mode: autocomplete\r\n  address: {}\r\niConfirmToHaveReadAndAcceptedPrivacyInformativeToThreatPersonalData: true\r\nlabel: help\r\nsubmit: true\r\n</yamldata></pre>", "created_at": "2022-03-08T06:25:04+00:00", "data": {"description": "", "email": "ciccio@graziani.com", "iConfirmToHaveReadAndAcceptedPrivacyInformativeToThreatPersonalData": true, "label": "help", "location": {"address": {}, "mode": "autocomplete"}, "nameSurname": "Ciccio Graziani", "phoneNumber": "12345", "recipients": "", "submit": true, "title": "prova", "url": ""}, "id": 1162272323, "image": null, "labels": "[\"Help\"]", "lat": null, "lon": null, "milestone": null, "provincia": null, "regione": null, "title": "prova", "updated_at": "2022-03-08T16:12:11+00:00", "url": "https://github.com/emergenzeHack/europehelp.info_segnalazioni/issues/41"}, "number": 41, "state": "open", "title": "prova"}, {"issue": {"body": "<pre><yamldata>\r\ntype: legal\r\nofferFromWho: Comune di Venezia\r\ntitle: 'Comune di #Venezia attiva Sportello Emergenza #Ucraina'\r\nrecipients: Rifugiati ucraini, famiglie ospitanti, cittadini\r\ndescription: A Venezia attivo sportello Emergenza Ucraina del Comune che offre info,\\\r\n  \\ supporto, assistenza ai rifugiati ucraini e alle famiglie italiane ospitanti.\\n\\\r\n  Tel. 041041 (DIME), lun-ven ore 8-20. \\nEmail ucraina@comune.venezia.it \\n(In lingua\\\r\n  \\ italiana e ucraina).\r\nurl: https://live.comune.venezia.it/it/2022/03/informazioni-le-persone-provenienti-dallucraina-e-le-famiglie-ospitanti\r\naddress:\r\n  mode: autocomplete\r\n  address:\r\n    place_id: 74210873\r\n    licence: Data © OpenStreetMap contributors, ODbL 1.0. https://osm.org/copyright\r\n    osm_type: node\r\n    osm_id: 6958414086\r\n    boundingbox:\r\n    - '45.2731957'\r\n    - '45.2732957'\r\n    - '12.3009922'\r\n    - '12.3010922'\r\n    lat: '45.2732457'\r\n    lon: '12.3010422'\r\n    display_name: Comune di Venezia, Calle Chiesa Ognissanti, Lido-Pellestrina, Pellestrina,\r\n      Venezia, Veneto, Italia\r\n    class: amenity\r\n    type: townhall\r\n    importance: 0.31100000000000005\r\n    address:\r\n      amenity: Comune di Venezia\r\n      road: Calle Chiesa Ognissanti\r\n      suburb: Lido-Pellestrina\r\n      village: Pellestrina\r\n      city: Venezia\r\n      county: Venezia\r\n      state: Veneto\r\n      country: Italia\r\n      country_code: it\r\niConfirmToHaveReadAndAcceptedInformativeToThreatPersonalData: true\r\nlabel: services\r\nsubmit: true\r\n</yamldata></pre>", "created_at": "2022-03-08T14:39:12+00:00", "data": {"address": {"address": {"address": {"amenity": "Comune di Venezia", "city": "Venezia", "country": "Italia", "country_code": "it", "county": "Venezia", "road": "Calle Chiesa Ognissanti", "state": "Veneto", "suburb": "Lido-Pellestrina", "village": "Pellestrina"}, "boundingbox": ["45.2731957", "45.2732957", "12.3009922", "12.3010922"], "class": "amenity", "display_name": "Comune di Venezia, Calle Chiesa Ognissanti, Lido-Pellestrina, Pellestrina, Venezia, Veneto, Italia", "importance": 0.31100000000000005, "lat": "45.2732457", "licence": "Data © OpenStreetMap contributors, ODbL 1.0. https://osm.org/copyright", "lon": "12.3010422", "osm_id": 6958414086, "osm_type": "node", "place_id": 74210873, "type": "townhall"}, "mode": "autocomplete"}, "description": "A Venezia attivo sportello Emergenza Ucraina del Comune che offre info,\\ \\ supporto, assistenza ai rifugiati ucraini e alle famiglie italiane ospitanti.\\n\\ Tel. 041041 (DIME), lun-ven ore 8-20. \\nEmail ucraina@comune.venezia.it \\n(In lingua\\ \\ italiana e ucraina).", "iConfirmToHaveReadAndAcceptedInformativeToThreatPersonalData": true, "label": "services", "offerFromWho": "Comune di Venezia", "recipients": "Rifugiati ucraini, famiglie ospitanti, cittadini", "submit": true, "title": "Comune di #Venezia attiva Sportello Emergenza #Ucraina", "type": "legal", "url": "https://live.comune.venezia.it/it/2022/03/informazioni-le-persone-provenienti-dallucraina-e-le-famiglie-ospitanti"}, "id": 1162736087, "image": null, "labels": "[\"Valid/Accettato\", \"Missing position\", \"Services\", \"Legal\", \"Helpful Contact\", \"Ospitalit\\u00e0\"]", "lat": null, "lon": null, "milestone": null, "provincia": null, "regione": null, "title": "Comune di Venezia attiva sportello Emergenza Ucraina", "updated_at": "2022-03-08T16:11:47+00:00", "url": "https://github.com/emergenzeHack/europehelp.info_segnalazioni/issues/42"}, "number": 42, "state": "open", "title": "Comune di Venezia attiva sportello Emergenza Ucraina"}]